review,cleaned_review
"Laptop tergolong ringan,tidak terlalu besar...mantabs",laptop tergolong ringan tidak terlalu besar mantabs
"pengiriman cepat, spek barang sesuai, packing aman",pengiriman cepat spek barang sesuai packing aman
manntab respon cepet barang ok dan original,manntab respon cepet barang ok dan original
"Barang cepat sampai dan sesuai informasi, Admin fast respon dan sangat membantu, recommended",barang cepat sampai dan sesuai informasi admin fast respon dan sangat membantu recommended
"spek sesuai deskripsi, pengiriman gercep, seller responsif",spek sesuai deskripsi pengiriman gercep seller responsif
Spesifikasi ok bgt plus hrg worth it dan udah plus RAM 32 gb. Terima kasih utk respon seller yg cepat sehingga bisa dikirim di hari yg sama.,spesifikasi ok bgt plus hrg worth it dan udah plus ram gb terima kasih utk respon seller yg cepat sehingga bisa dikirim di hari yg sama
"luar biasa, puas belanja di sini",luar biasa puas belanja di sini
"sesuai pesanan, semoga tidak ada kendala",sesuai pesanan semoga tidak ada kendala
"Produk sampai dengan selamat lebih cepat dari perkiraan pengiriman, dibungkus rapi. Laptopnya lebih ringan dari dugaan, kirain bakal gede dan berat tipikal gaming laptop.... ",produk sampai dengan selamat lebih cepat dari perkiraan pengiriman dibungkus rapi laptopnya lebih ringan dari dugaan kirain bakal gede dan berat tipikal gaming laptop
"barang sesuai, seller responsif, komunikatif dan ramah, pengiriman ok dan barang aman. terima kasih.
catatan; jangan lupa baca informasi kebijakan toko terkait pengiriman... ",barang sesuai seller responsif komunikatif dan ramah pengiriman ok dan barang aman terima kasih catatan jangan lupa baca informasi kebijakan toko terkait pengiriman
mantaapp rekomended seller ramah dan responsif,mantaapp rekomended seller ramah dan responsif
"Aman, kirim packing kayu ke mataram sampai dengan selamat",aman kirim packing kayu ke mataram sampai dengan selamat
"barang sesuai dgn yg diharapkan, semoga pelayanan service center nya jga sama OK nya. karena dlm waktu dkat mau minta pindahkan HDD dari laptop lama ke laptop baru beli i... ",barang sesuai dgn yg diharapkan semoga pelayanan service center nya jga sama ok nya karena dlm waktu dkat mau minta pindahkan hdd dari laptop lama ke laptop baru beli i
"kartu garansi, tas, charger dapet bonus screen cleaner lengkap, pengiriman sesuai estimasi",kartu garansi tas charger dapet bonus screen cleaner lengkap pengiriman sesuai estimasi
"Barang bagus dan original, ukuran layar besar dan pas di genggaman tangan yang besar.",barang bagus dan original ukuran layar besar dan pas di genggaman tangan yang besar
"hu huuu keren banget dah pokoknya, bisa request bentuk",hu huuu keren banget dah pokoknya bisa request bentuk
"lumayan cepet pengirimannya, sesuai ekspetasi",lumayan cepet pengirimannya sesuai ekspetasi
"Respon admin cepat, dan pengiriman lancar, barang juga bagus , recomended seller.",respon admin cepat dan pengiriman lancar barang juga bagus recomended seller
barang sudah diterima dan berfungsi dengan normal,barang sudah diterima dan berfungsi dengan normal
"packing rapi dan sangat aman untuk luar kota seperti saya , barang sesuai spek dan original .. pelayanan fast respon",packing rapi dan sangat aman untuk luar kota seperti saya barang sesuai spek dan original pelayanan fast respon
"Barangnya mendarat dengan.
Kualitas bagus.
semoga awet.
terima kasih MSI",barangnya mendarat dengan kualitas bagus semoga awet terima kasih msi
"Paket telah diterima dengan baik  &  sesuai penjelasan deskripsi di produk, Packing rapi Terimakasih.",paket telah diterima dengan baik sesuai penjelasan deskripsi di produk packing rapi terimakasih
"pengririman aman. sampai luar pulau dengan selamat. segel dan nyala lancar. 

mantap claw ini batere kuat tdp rendah game tetep lancar. sbagai mini pc gaming ke monitor i... ",pengririman aman sampai luar pulau dengan selamat segel dan nyala lancar mantap claw ini batere kuat tdp rendah game tetep lancar sbagai mini pc gaming ke monitor i
Produk dikirim di hari yg sama dan diterima dalam keadaan baik. Selama ini tidak ada masalah.,produk dikirim di hari yg sama dan diterima dalam keadaan baik selama ini tidak ada masalah
oh my god... ini yang papa cari selama ini...,oh my god ini yang papa cari selama ini
"sesuai pesanan. dus ada yg penyok.,tapi untung gak tembus ke laptop.",sesuai pesanan dus ada yg penyok tapi untung gak tembus ke laptop
"Pengiriman cepat, spek gahar harga murah",pengiriman cepat spek gahar harga murah
Bagus,bagus
"Performanya bagus, layanan penjual juga cepat tanggap",performanya bagus layanan penjual juga cepat tanggap
mantap fast respon di kirim key langsung,mantap fast respon di kirim key langsung
"Barang cocok, cepat sampai, admin responsif... mantap 👌",barang cocok cepat sampai admin responsif mantap
"pengiriman tepat, respon cepat , barang ORI",pengiriman tepat respon cepat barang ori
"pelayanan terbaik, barang sesuai hingga pengiriman cepat.",pelayanan terbaik barang sesuai hingga pengiriman cepat
"packing tebal, response seller cepat dan informatif, barang sesuai deskripsi dan mulus, sementara blum ada kendala dgn unit yg diterima",packing tebal response seller cepat dan informatif barang sesuai deskripsi dan mulus sementara blum ada kendala dgn unit yg diterima
"Sesuai deskripsi packing aman, fast response, recommended seller",sesuai deskripsi packing aman fast response recommended seller
"mendarat selamat, sesuai pesanan, mantaps.",mendarat selamat sesuai pesanan mantaps
"Untuk spesifikasi yang cukup tinggi ini, harganya tergolong terjangkau",untuk spesifikasi yang cukup tinggi ini harganya tergolong terjangkau
Joss,joss
Barang original dan sesuai spek… proses cepat… reques instal smua dibantu… makasih ya,barang original dan sesuai spek proses cepat reques instal smua dibantu makasih ya
"Is gud, cepat dan semua jenis ruang (storage, ram, ukuran layar dan keyboard) luas dan memuaskan",is gud cepat dan semua jenis ruang storage ram ukuran layar dan keyboard luas dan memuaskan
"saya puas dgn produk MSI, mantap dan saya selalu mendapat  layanan prima. saya sudah mulai berlanggan 21 Juli 2022 (MSI Modern 14 B11MOU) hingga 06 September 2025 (Modern... ",saya puas dgn produk msi mantap dan saya selalu mendapat layanan prima saya sudah mulai berlanggan juli msi modern bmou hingga september modern
barang dateng aku senang,barang dateng aku senang
barang sesuai deskripsi. sejauh ini gak ada masalah. thx,barang sesuai deskripsi sejauh ini gak ada masalah thx
"build quality msih kalah sama lenovo,tpi spek dan harga masih terbaik ini 👍👍👍👍",build quality msih kalah sama lenovo tpi spek dan harga masih terbaik ini
"Nemu harta karun buat bocah.
Ngak disangka dapet harga segini.
Seller Top Banget Dah.
Pengiriman OK
Barang Dahsyat Banget",nemu harta karun buat bocah ngak disangka dapet harga segini seller top banget dah pengiriman ok barang dahsyat banget
"sesuai expektasi, mantap",sesuai expektasi mantap
sesuai,sesuai
"waktu instal cepat. responsif... ringan,",waktu instal cepat responsif ringan
"barang ok, cs dan staff saat pickup ramah dan helpful",barang ok cs dan staff saat pickup ramah dan helpful
"Oke banget cepet sampainya, ga perlu tanbah packing kayu udh aman. Cuma dari laptopnya sendiri agak cepet panas yah harus beli cooling pad laptop nih:”",oke banget cepet sampainya ga perlu tanbah packing kayu udh aman cuma dari laptopnya sendiri agak cepet panas yah harus beli cooling pad laptop nih
"barangnya bagus banget, reseller juga ramah dan fast respond",barangnya bagus banget reseller juga ramah dan fast respond
"Sempat ada Kendala, karena ingin cepat akhirnya saya bawa ketokonya, dan alhamdullilah sudah terselesaikan, semoga kedepannya, tim teknis toko dapat mengecek kembali pesa... ",sempat ada kendala karena ingin cepat akhirnya saya bawa ketokonya dan alhamdullilah sudah terselesaikan semoga kedepannya tim teknis toko dapat mengecek kembali pesa
"so far baik-baik aja, seller responsif, dan sangat membantu kalo ada masalah,

trusted, mau ngelayanin pertanyaan detil dari pembeli",so far baikbaik aja seller responsif dan sangat membantu kalo ada masalah trusted mau ngelayanin pertanyaan detil dari pembeli
"Packaging oke, Spesifikasi²nya sesuai dengan yang tertera, Untuk pemakaiannya juga oke banget",packaging oke spesifikasinya sesuai dengan yang tertera untuk pemakaiannya juga oke banget
"sejauh ini ga ada masalah, admin fast responses. semoga no trouble yaa, thanks",sejauh ini ga ada masalah admin fast responses semoga no trouble yaa thanks
Sdh langganan yang ketiga...mantap,sdh langganan yang ketiga mantap
laptop sdh dicoba dan berjalan normal.,laptop sdh dicoba dan berjalan normal
"Barang dikemas dengan baik dan tidak perlu kuatir kena hujam karena dibungkan plastik 2 lapis,  dan dikirim tepat waktu.",barang dikemas dengan baik dan tidak perlu kuatir kena hujam karena dibungkan plastik lapis dan dikirim tepat waktu
mantaaaappp,mantaaaappp
"T O P 👍🏻 
Seller fast respond, gercep. Barang lengkap, OK ⭐️⭐️⭐️⭐️⭐️",t o p seller fast respond gercep barang lengkap ok
"setelah update terbaru, driver Intel Arc sekarang lebih baik jalan di di TDP 10W, bisa jalan 40-50 fps setelah coba di beberapa game AAA kalau pakai XeSS bisa lebih",setelah update terbaru driver intel arc sekarang lebih baik jalan di di tdp w bisa jalan fps setelah coba di beberapa game aaa kalau pakai xess bisa lebih
"respon cepat dan barang sesuai deskripsi, berjalan normal, berfungsi baik. Langganan",respon cepat dan barang sesuai deskripsi berjalan normal berfungsi baik langganan
Oke mantap barang sesuai,oke mantap barang sesuai
mantap semoga gk rewell,mantap semoga gk rewell
"barang bagus...👍🏻
pengiriman cepat...👍🏻
puas dgn layanan nya 😁🙏🏻",barang bagus pengiriman cepat puas dgn layanan nya
"Produk mantap, pelayanan dan respon cepet, rekomen banget",produk mantap pelayanan dan respon cepet rekomen banget
diterima dengan baik. mantab. barang berfungsi dengan baik.,diterima dengan baik mantab barang berfungsi dengan baik
"Barang asli ,sesuai dengan pesanan ,produk mulus",barang asli sesuai dengan pesanan produk mulus
"Perfecta handheld console para mi.. good performa, sleek design, good build quality. Pelayanan toko-nya juga bagus banget, ramah dan cepat.. 👌🏼👌🏼",perfecta handheld console para mi good performa sleek design good build quality pelayanan tokonya juga bagus banget ramah dan cepat
"durasi unboxing kepanjangan gk bisa keupload min, btw barang dateng puas tidak ada minus. Adminnya ramah untuk customer yg banyak nanya kek saya 🤍",durasi unboxing kepanjangan gk bisa keupload min btw barang dateng puas tidak ada minus adminnya ramah untuk customer yg banyak nanya kek saya
"Pengiriman “kurir toko” tapi suruh ambil sendiri, ditengah demo huru hara pula",pengiriman kurir toko tapi suruh ambil sendiri ditengah demo huru hara pula
good performance,good performance
barang sudah sampe dan aman cuma minusnya pengiriman yang agak lama 😅,barang sudah sampe dan aman cuma minusnya pengiriman yang agak lama
"Entah order yg ke berapa kali, sdh tdk ingat, yg jelas kualitas tetap terjaga tanpa pernah komplain. sayangnya gak pernah kasih gift sebagai award. recommanded seller pok... ",entah order yg ke berapa kali sdh tdk ingat yg jelas kualitas tetap terjaga tanpa pernah komplain sayangnya gak pernah kasih gift sebagai award recommanded seller pok
barangnya bagus. sangat direkomendasikan,barangnya bagus sangat direkomendasikan
Reviewnya udah tayang di channelku Youtubeku @bangripiu 😌,reviewnya udah tayang di channelku youtubeku bangripiu
"sipp, sesuai ekspektasi. pas dapat harga murce",sipp sesuai ekspektasi pas dapat harga murce
"datang dengan kualitas prima tanpa cacat, RAM sesuai, dan bisa klaim OHS.",datang dengan kualitas prima tanpa cacat ram sesuai dan bisa klaim ohs
Barang sesuai deskripsi dan dikemas dengan baik,barang sesuai deskripsi dan dikemas dengan baik
Mantapp barang baguss laptop orii,mantapp barang baguss laptop orii
"KEREN NO KOMEN, DIPAKE MAEN GAMES KEBUT, DIPAKE TRADINGAN APALAGI, THE BEST MSI CLAW 8AI+",keren no komen dipake maen games kebut dipake tradingan apalagi the best msi claw ai
The best pokoknya,the best pokoknya
Sempet bermasalah dapet yang gagal product sampai hrus ke pusat ganti bolak balik 3x,sempet bermasalah dapet yang gagal product sampai hrus ke pusat ganti bolak balik x
good. cuma di gambar bonus tws. tp gak dapat,good cuma di gambar bonus tws tp gak dapat
mantab.. sesuai pesanan,mantab sesuai pesanan
pengiriman tepat waktu meski jakarta lagi demo. unit segel. garansi resmi,pengiriman tepat waktu meski jakarta lagi demo unit segel garansi resmi
sangat baik dengan harga yg kompetitif dengan brand lain,sangat baik dengan harga yg kompetitif dengan brand lain
Mantapu Jiwa Raga Indonesia Raya Merdeka,mantapu jiwa raga indonesia raya merdeka
"mantab bosku!! 
Cepat sampai... produk original.. recomended seller....",mantab bosku cepat sampai produk original recomended seller
barangnya sesuai tanpa lecet dan kurir tepat waktu,barangnya sesuai tanpa lecet dan kurir tepat waktu
"Setelag dipakai kerja, kualitas dan performanya optimal.Ringan dan desainnya mewah..
packing rapi dan cepat
Tks seller untuk pelayanannya",setelag dipakai kerja kualitas dan performanya optimal ringan dan desainnya mewah packing rapi dan cepat tks seller untuk pelayanannya
